1. DDL (Data Definition Language) Questions
Q1: Create a department table with the following columns: dept_id (PK), dept_name (not null), dept_location.

SQL>CREATE TABLE department110(dept_id varchar(10) primary key, dept_name varchar(10) not null,dept_location varchar(10));
Table created.

SQL> describe department110;
 Name   Null?    Type
 ----------------------------------------- -------- ----------------------------
 DEPT_ID   NOT NULL VARCHAR(10)
 DEPT_NAME   NOT NULL VARCHAR(10)
 DEPT_LOCATION    VARCHAR(10)
=============================================================================================================================================================================

Q2: Write a SQL query to create an employee table with the following columns: emp_id(PK), emp_name, emp_salary (>20k), emp_join_date (between June 1998- till date), dept_id (FK).

SQL> CREATE TABLE employee110 (emp_id VARCHAR(10) PRIMARY KEY, emp_name VARCHAR(10), emp_salary NUMERIC(12, 2) CHECK (emp_salary > 20000), emp_joindate DATE CHECK (emp_joindate >= DATE '1998-06-01'),dept_id VARCHAR(10), FOREIGN KEY (dept_id) REFERENCES department110(dept_id));
Table created.

SQL> describe employee110;
 Name   Null?    Type
 ----------------------------------------- -------- ----------------------------
 EMP_ID   NOT NULL VARCHAR2(10)
 EMP_NAME    VARCHAR(10)
 EMP_SALARY    NUMBER(12,2)
 EMP_JOINDATE    DATE
 DEPT_ID    VARCHAR(10)
==========================================================================================================================================================================================================================================================================================

Q3: Create table support table with s_id (PK), emp_id (FK), dept_id (FK), status (Yes/No).

SQL> CREATE TABLE support110(s_id VARCHAR(10) PRIMARY KEY, emp_id VARCHAR(10), dept_id VARCHAR(10),status VARCHAR(3) CHECK (status IN ('Yes', 'No')), FOREIGN KEY (emp_id) REFERENCES employee110(emp_id), FOREIGN KEY (dept_id) REFERENCES department110(dept_id));
Table created.

SQL> describe support110;
 Name   Null?    Type
 ----------------------------------------- -------- ----------------------------
 S_ID   NOT NULL VARCHAR2(10)
 EMP_ID    VARCHAR(10)
 DEPT_ID    VARCHAR(10)
 STATUS    VARCHAR(3)
=========================================================================================================================================================================================================================================================================================

Q4: Display the schema of the above three tables.
SQL> describe support110;
 Name   Null?    Type
 ----------------------------------------- -------- ----------------------------
 S_ID   NOT NULL VARCHAR(10)
 EMP_ID    VARCHAR(10)
 DEPT_ID    VARCHAR(10)
 STATUS    VARCHAR(3)

SQL> describe employee110
 Name   Null?    Type
 ----------------------------------------- -------- ----------------------------
 EMP_ID   NOT NULL VARCHAR(10)
 EMP_NAME    VARCHAR(10)
 EMP_SALARY    NUMBER(12,2)
 EMP_JOINDATE    DATE
 DEPT_ID    VARCHAR(10)

SQL> describe department110;
 Name   Null?    Type
 ----------------------------------------- -------- ----------------------------
 DEPT_ID   NOT NULL VARCHAR(10)
 DEPT_NAME   NOT NULL VARCHAR(10)
 DEPT_LOCATION    VARCHAR(10)
===============================================================================================================================================================================================================================================================

Q5: Alter the employee table to add a new column emp_email of type VARCHAR(100).
SQL>ALTER TABLE employee110 ADD emp_email VARCHAR(100);
Table altered.
SQL> describe employee110;
 Name   Null?    Type
 ----------------------------------------- -------- ----------------------------
 EMP_ID   NOT NULL VARCHAR2(10)
 EMP_NAME    VARCHAR(10)
 EMP_SALARY    NUMBER(12,2)
 EMP_JOINDATE    DATE
 DEPT_ID    VARCHAR(10)
 EMP_EMAIL    VARCHAR(100)
=======================================================================================================================================================================================

Q6: Drop the support table if it is no longer required.
SQL> DROP TABLE support110;

Table dropped.
====================================================================================================================================================================================
Q7: Modify the emp_salary column in the employee table to allow values up to
DECIMAL(12, 2).
SQL> ALTER TABLE employee110 MODIFY emp_salary DECIMAL(12, 2);

Table altered.

SQL> describe employee110
 Name   Null?    Type
 ----------------------------------------- -------- ----------------------------
 EMP_ID   NOT NULL VARCHAR2(10)
 EMP_NAME    VARCHAR2(10)
 EMP_SALARY    NUMBER(12,2)
 EMP_JOINDATE    DATE
 DEPT_ID    VARCHAR2(10)
 EMP_EMAIL    VARCHAR2(100)
===================================================================================================================================================================================================
Q8: Add five suitable records to department table (Let value of dept_id starts with 101).
SQL> INSERT INTO department110 (dept_id, dept_name, dept_location) VALUES ('101', 'Computer Science', 'NorthBlk');

1 row created.

SQL> INSERT INTO department110 (dept_id, dept_name, dept_location) VALUES ('102', 'Finance', 'EastBlk');

1 row created.

SQL> INSERT INTO department110 (dept_id, dept_name, dept_location) VALUES ('103', 'Mechanical', 'SouthBlk');

1 row created.

SQL> INSERT INTO department110 (dept_id, dept_name, dept_location) VALUES ('104', 'Civil', 'West Blk');

1 row created.

SQL> INSERT INTO department110 (dept_id, dept_name, dept_location) VALUES ('105', 'MCA', 'NorthBlk');

1 row created.

SQL> select * from department110;

DEPT_ID    DEPT_NAME DEPT_LOCATION
---------- -------------------- --------------------
101   Computer Science NorthBlk
102   Finance EastBlk
103   Mechanical SouthBlk
104   Civil West Blk
105   MCA NorthBlk
=======================================================================================================================================================================================================
Q9: Insert the following employee record into the employee table: emp_id = 1, emp_name= 'John Doe', emp_salary = 60000, emp_join_date = '15-05-2021', dept_id= 101.

SQL> INSERT INTO employee110 (emp_id, emp_name, emp_salary, emp_joindate, dept_id) VALUES ('1', 'John Doe', 60000, TO_DATE('15-05-2021', 'DD-MM-YYYY'), '101');
1 row created.
SQL> select * from employee110;

EMP_ID   EMP_NAME   EMP_SALARY EMP_JOIND DEPT_ID
---------- ---------- ---------- --------- ----------
EMP_EMAIL
--------------------------------------------------------------------------------
1   John Doe   60000 15-MAY-21 101
=========================================================================================================================================================================================================
Q10: Insert multiple records of employees into the employee table with emp_id, emp_name,
emp_salary, and dept_id.

SQL> INSERT INTO employee110 (emp_id, emp_name, emp_salary, emp_joindate, dept_id) VALUES ('2', 'Santhosh', 55000, TO_DATE('01-06-2020', 'DD-MM-YYYY'), '102');

1 row created.

SQL> INSERT INTO employee110 (emp_id, emp_name, emp_salary, emp_joindate, dept_id) VALUES ('3', 'Sona Mary', 75000, TO_DATE('15-07-2019', 'DD-MM-YYYY'), '103');

1 row created.

SQL> INSERT INTO employee110 (emp_id, emp_name, emp_salary, emp_joindate, dept_id) VALUES ('4', 'Sujesh', 62000, TO_DATE('10-08-2018', 'DD-MM-YYYY'), '104');

1 row created.

SQL> INSERT INTO employee110 (emp_id, emp_name, emp_salary, emp_joindate, dept_id) VALUES ('5', 'Deepa', 68000, TO_DATE('20-09-2017', 'DD-MM-YYYY'), '105');

1 row created.

SQL> INSERT INTO employee110 (emp_id, emp_name, emp_salary, emp_joindate, dept_id) VALUES ('6', 'Shidha', 54000, TO_DATE('05-12-2021', 'DD-MM-YYYY'), '101');

1 row created.

SQL> SELECT * FROM employee110;

EMP_ID   EMP_NAME      EMP_SALARY
---------- -------------------------------------------------- ----------
EMP_JOIND DEPT_ID
--------- ----------
EMP_EMAIL
--------------------------------------------------------------------------------
1   John Doe   60000
15-MAY-21 101


2   Ava   55000
01-JUN-20 102


EMP_ID   EMP_NAME      EMP_SALARY
---------- -------------------------------------------------- ----------
EMP_JOIND DEPT_ID
--------- ----------
EMP_EMAIL
--------------------------------------------------------------------------------

3  Ishaan   75000
15-JUL-19 103


4   Angel   62000
10-AUG-18 104

EMP_ID   EMP_NAME      EMP_SALARY
---------- -------------------------------------------------- ----------
EMP_JOIND DEPT_ID
--------- ----------
EMP_EMAIL
--------------------------------------------------------------------------------


5   Evlyn  68000
20-SEP-17 105


6  Amella   54000

EMP_ID   EMP_NAME      EMP_SALARY
---------- -------------------------------------------------- ----------
EMP_JOIND DEPT_ID
--------- ----------
EMP_EMAIL
--------------------------------------------------------------------------------
05-DEC-21 101



6 rows selected.
=====================================================================================================================================================================================================================
Q11: Update the salary of the employee with emp_id = 1 by increasing it by 10%.

SQL> UPDATE employee110 SET emp_salary = emp_salary * 1.10 WHERE emp_id = '1';

1 row updated.

SQL> select * from employee110;

EMP_ID   EMP_NAME      EMP_SALARY
---------- -------------------------------------------------- ----------
EMP_JOIND DEPT_ID
--------- ----------
EMP_EMAIL
--------------------------------------------------------------------------------
1   John Doe   66000
15-MAY-21 101


2   Ava   55000
01-JUN-20 102


EMP_ID   EMP_NAME      EMP_SALARY
---------- -------------------------------------------------- ----------
EMP_JOIND DEPT_ID
--------- ----------
EMP_EMAIL
--------------------------------------------------------------------------------

3  Angel   75000
15-JUL-19 103


4   Evlyn   62000
10-AUG-18 104

EMP_ID   EMP_NAME      EMP_SALARY
---------- -------------------------------------------------- ----------
EMP_JOIND DEPT_ID
--------- ----------
EMP_EMAIL
--------------------------------------------------------------------------------


5   Evlyn   68000
20-SEP-17 105


6   Amella   54000

EMP_ID   EMP_NAME      EMP_SALARY
---------- -------------------------------------------------- ----------
EMP_JOIND DEPT_ID
--------- ----------
EMP_EMAIL
--------------------------------------------------------------------------------
05-DEC-21 101



6 rows selected.
===============================================================================================================================================================================================
Q12: Delete the record of the employee with emp_id = 1.

SQL> DELETE FROM employee109 WHERE emp_id = '1';            

1 row deleted.

SQL> select * from employee110;

EMP_ID   EMP_NAME      EMP_SALARY
---------- -------------------------------------------------- ----------
EMP_JOIND DEPT_ID
--------- ----------
EMP_EMAIL
--------------------------------------------------------------------------------
2   Ishaan   55000
01-JUN-20 102


3   Angel   75000
15-JUL-19 103


EMP_ID   EMP_NAME      EMP_SALARY
---------- -------------------------------------------------- ----------
EMP_JOIND DEPT_ID
--------- ----------
EMP_EMAIL
--------------------------------------------------------------------------------

4  Evlyn   62000
10-AUG-18 104


5   Amella   68000
20-SEP-17 105

EMP_ID   EMP_NAME      EMP_SALARY
---------- -------------------------------------------------- ----------
EMP_JOIND DEPT_ID
--------- ----------
EMP_EMAIL
--------------------------------------------------------------------------------


6   Ashley 5400
05-DEC-21 101
================================================================================================================================================================================================================
Q13:Update the emp_salary of employees in dept_id = 101 to 10% more if their current
salary is less than 50000.

SQL> UPDATE employee110 SET emp_salary = emp_salary * 1.10 WHERE dept_id = '101' AND emp_salary < 50000;

0 rows updated.

SQL> select * from employee110;

EMP_ID   EMP_NAME      EMP_SALARY
---------- -------------------------------------------------- ----------
EMP_JOIND DEPT_ID
--------- ----------
EMP_EMAIL
--------------------------------------------------------------------------------
2   Ishaan 0
01-JUN-20 102


3   Sona Mary   75000
15-JUL-19 103


EMP_ID   EMP_NAME      EMP_SALARY
---------- -------------------------------------------------- ----------
EMP_JOIND DEPT_ID
--------- ----------
EMP_EMAIL
--------------------------------------------------------------------------------

4   Sujesh   62000
10-AUG-18 104


5   Deepa   68000
20-SEP-17 105

EMP_ID   EMP_NAME      EMP_SALARY
---------- -------------------------------------------------- ----------
EMP_JOIND DEPT_ID
--------- ----------
EMP_EMAIL
--------------------------------------------------------------------------------


6   Shidha   54000
05-DEC-21 101
===================================================================================================================================================================
Q14: Write a SELECT query to list all employees with their emp_id, emp_name, and
emp_salary.
SQL> SELECT emp_id, emp_name, emp_salary FROM employee110;

EMP_ID   EMP_NAME      EMP_SALARY
---------- -------------------------------------------------- ----------
2   Santhosh   55000
3   Sona Mary   75000
4   Sujesh   62000
5   Deepa   68000
6   Shidha   54000
==============================================================================================================================================================
Q15: Retrieve the emp_name, emp_salary, and emp_join_date for employees whose
salary is greater than 50000.
SQL> SELECT emp_name, emp_salary, emp_joindate FROM employee110 WHERE emp_salary > 50000;

EMP_NAME   EMP_SALARY EMP_JOIND
-------------------------------------------------- ---------- ---------
Santhosh 55000 01-JUN-20
Sona Mary 75000 15-JUL-19
Sujesh 62000 10-AUG-18
Deepa 68000 20-SEP-17
Shidha 54000 05-DEC-21
===========================================================================================================================================
Q16: List employees in the employee table ordered by emp_salary in descending order.

SQL> SELECT * FROM employee110 ORDER BY emp_salary DESC;

EMP_ID   EMP_NAME      EMP_SALARY
---------- -------------------------------------------------- ----------
EMP_JOIND DEPT_ID
--------- ----------
EMP_EMAIL
--------------------------------------------------------------------------------
3   Sona Mary   75000
15-JUL-19 103


5   Deepa   68000
20-SEP-17 105


EMP_ID   EMP_NAME      EMP_SALARY
---------- -------------------------------------------------- ----------
EMP_JOIND DEPT_ID
--------- ----------
EMP_EMAIL
--------------------------------------------------------------------------------

4   Sujesh   62000
10-AUG-18 104


2   Santhosh   55000
01-JUN-20 102

EMP_ID   EMP_NAME      EMP_SALARY
---------- -------------------------------------------------- ----------
EMP_JOIND DEPT_ID
--------- ----------
EMP_EMAIL
--------------------------------------------------------------------------------


6   Shidha   54000
05-DEC-21 101
============================================================================================================================================
Q17: Retrieve all employees' names and salaries who joined after 01-01-2020.

SQL> SELECT emp_name, emp_salary FROM employee110 WHERE emp_joindate > TO_DATE('01-01-2020', 'DD-MM-YYYY');

EMP_NAME   EMP_SALARY
-------------------------------------------------- ----------
Santhosh 55000
Shidha 54000
======================================================================================================================================================================
Q18: Write a query to select all employees whose name starts with "J"

SQL> SELECT emp_id, emp_name, emp_salary FROM employee110 WHERE emp_name LIKE 'J%';

EMP_ID   EMP_NAME      EMP_SALARY
---------- -------------------------------------------------- ----------
7   John Cs   60000
================================================================================================================================================
Q19: Select the emp_name and emp_salary for employees whose salary is between 40000
and 60000.

SQL> SELECT emp_name, emp_salary FROM employee110 WHERE emp_salary BETWEEN 40000 AND 60000;

EMP_NAME   EMP_SALARY
-------------------------------------------------- ----------
John Cs 60000
Sandhosh 55000
Shidha 54000


